publisher,title,author,url,published_at,source
Palo Alto Networks,Introducing Palo Alto Networks Quantum-Safe Security,"Rich Campagna, Richu Channakeshava",https://www.paloaltonetworks.com/blog/2026/01/introducing-quantum-safe-security/,"Tue, 27 Jan 2026 21:19:10 +0000",RSS Feed
Palo Alto Networks,What the Alien Franchise Taught Me About Cybersecurity,Dena De Angelo,https://www.paloaltonetworks.com/blog/2026/01/alien-franchise-taught-cybersecurity/,"Thu, 22 Jan 2026 18:10:31 +0000",RSS Feed
Palo Alto Networks,Unified AI-Powered Security,Jesper Olsen,https://www.paloaltonetworks.com/blog/2026/01/unified-ai-powered-security/,"Fri, 16 Jan 2026 17:00:26 +0000",RSS Feed
Palo Alto Networks,Bridging Cybersecurity and AI,"Julie Klein, Adam Nygate",https://www.paloaltonetworks.com/blog/2026/01/bridging-cybersecurity-and-ai/,"Thu, 15 Jan 2026 13:00:22 +0000",RSS Feed
Cisco Security,Facing the Quantum Threat: Cisco’s Strategic Approach to PQC,"Christian Chisholm,",https://blogs.cisco.com/security/facing-the-quantum-threat-ciscos-strategic-approach-to-pqc/,"Thu, 05 Feb 2026 13:00:00 +0000",RSS Feed
Cisco Security,Cisco is Proud to Champion the UK’s Software Security Code of Practice,"Larry Lidz,",https://blogs.cisco.com/security/cisco-proud-champion-of-uk-software-security-code-of-practice/,"Tue, 03 Feb 2026 13:00:00 +0000",RSS Feed
Cisco Security,Foundation-sec-8B-Reasoning: The First Open-weight Security Reasoning Model,"Yaron Singer, Amin Karbasi",https://blogs.cisco.com/security/foundation-sec-8b-reasoning-first-open-weight-security-reasoning-model/,"Thu, 29 Jan 2026 13:00:48 +0000",RSS Feed
Cisco Security,Introducing The PEAK Threat Hunting Assistant: Agentic AI to Supercharge Your Hunt,"David Bianco,",https://blogs.cisco.com/security/introducing-peak-threat-hunting-assistant/,"Thu, 29 Jan 2026 13:00:17 +0000",RSS Feed
Cisco Security,Cisco Foundation AI Advances Agentic Security Systems for the AI Era,"Yaron Singer,",https://blogs.cisco.com/security/foundation-ai-advances-agentic-security-systems-for-ai-era/,"Thu, 29 Jan 2026 13:00:04 +0000",RSS Feed
CrowdStrike,"What Security Teams Need to Know About OpenClaw, the AI Super Agent",Elia Zaitsev,https://www.crowdstrike.com/en-us/blog/what-security-teams-need-to-know-about-openclaw-ai-super-agent/,"Feb 04, 2026 00:00:00-0800",RSS Feed
CrowdStrike,CrowdStrike Named a Customers&rsquo; Choice in 2026 Gartner Peer Insights&trade; Voice of the Customer for Application Security Posture Management Tools,Bhavna B. Sehgal,https://www.crowdstrike.com/en-us/blog/crowdstrike-named-customers-choice-2026-gartner-peer-insights-voice-of-the-customer-for-aspm/,"Feb 03, 2026 00:00:00-0800",RSS Feed
CrowdStrike,CrowdStrike Falcon Scores Perfect 100% in SE Labs&rsquo; Most Challenging Ransomware Test,Brad Moon,https://www.crowdstrike.com/en-us/blog/crowdstrike-falcon-scores-100-percent-in-se-labs-ransomware-test/,"Feb 03, 2026 00:00:00-0800",RSS Feed
CrowdStrike,How Agentic Tool Chain Attacks Threaten AI Agent Security,Vanessa Villa,https://www.crowdstrike.com/en-us/blog/how-agentic-tool-chain-attacks-threaten-ai-agent-security/,"Jan 30, 2026 00:00:00-0800",RSS Feed
CrowdStrike,Data Protection Day 2026: From Compliance to Resilience,Drew Bagley - Christoph Bausewein,https://www.crowdstrike.com/en-us/blog/data-protection-day-2026-from-compliance-to-resilience/,"Jan 28, 2026 00:00:00-0800",RSS Feed
CrowdStrike,"Small Devices, Big Risk: USB Drives Threaten Enterprise Security",Luke Hunsinger - Dana Larson,https://www.crowdstrike.com/en-us/blog/usb-drives-threaten-enterprise-security/,"Jan 21, 2026 00:00:00-0600",RSS Feed
Check Point,SaaS Abuse at Scale: Phone-Based Scam Campaign Leveraging Trusted Platforms,rohann@checkpoint.com,https://blog.checkpoint.com/research/saas-abuse-at-scale-phone-based-scam-campaign-leveraging-trusted-platforms/,"Thu, 05 Feb 2026 12:00:36 +0000",RSS Feed
Check Point,The Trends Defining Cyber Security in 2026: Cyber Security Report 2026,rohann@checkpoint.com,https://blog.checkpoint.com/research/the-trends-defining-cyber-security-in-2026-cyber-security-report-2026/,"Wed, 28 Jan 2026 12:00:13 +0000",RSS Feed
Check Point,Closing the Cyber Security Skills Gap: Check Point Partners with CompTIA,rohann@checkpoint.com,https://blog.checkpoint.com/infinity-global-services/closing-the-cyber-security-skills-gap-check-point-partners-with-comptia/,"Tue, 27 Jan 2026 12:00:13 +0000",RSS Feed
Check Point,Building Cyber Readiness Early: Why Youth Education Is a Security Necessity,rohann@checkpoint.com,https://blog.checkpoint.com/company-and-culture/building-cyber-readiness-early-why-youth-education-is-a-security-imperative/,"Fri, 23 Jan 2026 12:00:28 +0000",RSS Feed
Check Point,AI-Powered North Korean Konni Malware Targets Developers,rohann@checkpoint.com,https://blog.checkpoint.com/research/ai-powered-north-korean-konni-malware-targets-developers/,"Thu, 22 Jan 2026 12:00:54 +0000",RSS Feed
Check Point,"Attackers Continue to Target Trusted Collaboration Platforms: 12,000+ Emails Target Teams Users",Unknown,https://blog.checkpoint.com/email-security/attackers-continue-to-target-trusted-collaboration-platforms-12000-emails-target-teams-users/,"Thu, 22 Jan 2026 12:00:51 +0000",RSS Feed
