publisher,title,author,url,published_at,source
Palo Alto Networks,From the Hill: The AI-Cybersecurity Imperative in Financial Services,Wendi Whitmore,https://www.paloaltonetworks.com/blog/2025/12/ai-cybersecurity-in-financial-services/,"Thu, 18 Dec 2025 14:00:58 +0000",RSS Feed
Palo Alto Networks,Where Cloud Security Stands Today and Where AI Breaks It,Cody Queen,https://www.paloaltonetworks.com/blog/2025/12/cloud-security-2025-report-insights/,"Tue, 16 Dec 2025 13:00:58 +0000",RSS Feed
Palo Alto Networks,Untangling Hybrid Cloud Security,"Jasmine Punia, Aniket Daptari",https://www.paloaltonetworks.com/blog/2025/12/untangling-hybrid-cloud-security/,"Tue, 16 Dec 2025 12:59:04 +0000",RSS Feed
Palo Alto Networks,Winning the AI Race Starts with the Right Security Platform,"Hitendar Sethi, Lahary Ravuri",https://www.paloaltonetworks.com/blog/2025/12/winning-ai-race-starts-with-right-security-platform/,"Tue, 09 Dec 2025 18:31:50 +0000",RSS Feed
Palo Alto Networks,Partners Are Fueling Innovation with Cortex XSIAM and Prisma SASE,"Greg Smith, Kritika Singhal",https://www.paloaltonetworks.com/blog/2025/12/partners-fueling-innovation-with-cortex-xsiam-and-prisma-sase/,"Tue, 09 Dec 2025 18:30:26 +0000",RSS Feed
Cisco Security,Elevating Data Security: New DLP Enhancements in Cisco Secure Access,"Jeff Scheaffer, Allon Ram",https://blogs.cisco.com/security/new-dlp-power-cisco-secure-access/,"Fri, 19 Dec 2025 13:00:00 +0000",RSS Feed
Cisco Security,Unify IT Asset Management and Network Security in Real Time: Cisco ISE and ServiceNow Are Redefining Asset-Aware Access,"Amith Ronad,",https://blogs.cisco.com/security/cisco-ise-servicenow-redefining-asset-aware-access/,"Wed, 17 Dec 2025 13:00:18 +0000",RSS Feed
CrowdStrike,AI Tool Poisoning: How Hidden Instructions Threaten AI Agents,Vanessa Villa,https://www.crowdstrike.com/en-us/blog/ai-tool-poisoning/,"Jan 09, 2026 00:00:00-0600",RSS Feed
CrowdStrike,How CrowdStrike&rsquo;s Malware Analysis Agent Detects Malware at Machine Speed,Rob Horrigan - Thuy Nguyen,https://www.crowdstrike.com/en-us/blog/how-crowdstrike-detects-malware-at-machine-speed/,"Jan 06, 2026 00:00:00-0600",RSS Feed
CrowdStrike,Streamline Security Operations with Falcon for IT&rsquo;s Turnkey Automations,Michael Devins,https://www.crowdstrike.com/en-us/blog/streamline-security-operations-falcon-for-it-automations/,"Dec 29, 2025 00:00:00-0600",RSS Feed
CrowdStrike,CrowdStrike Endpoint Security Achieves 273% ROI Over Three Years,Dana Larson,https://www.crowdstrike.com/en-us/blog/crowdstrike-endpoint-security-achieves-273-percent-roi-over-three-years/,"Dec 17, 2025 00:00:00-0600",RSS Feed
CrowdStrike,CrowdStrike Secures Growing AI Attack Surface with Falcon AI Detection and Response,John Gamble,https://www.crowdstrike.com/en-us/blog/crowdstrike-secures-growing-ai-attack-surface-with-falcon-aidr/,"Dec 15, 2025 00:00:00-0600",RSS Feed
Check Point,Check Point Supports Google Cloud Network Security Integration,rohann@checkpoint.com,https://blog.checkpoint.com/securing-the-cloud/check-point-supports-google-cloud-network-security-integration/,"Wed, 07 Jan 2026 12:00:04 +0000",RSS Feed
Check Point,Cyber Resilience Starts with Training: Why Skills Define Security Success,rohann@checkpoint.com,https://blog.checkpoint.com/infinity-global-services/cyber-resilience-starts-with-training-why-skills-define-security-success/,"Tue, 30 Dec 2025 12:00:07 +0000",RSS Feed
Check Point,Phishing Campaign Leverages Trusted Google Cloud Automation Capabilities to Evade Detection,rohann@checkpoint.com,https://blog.checkpoint.com/research/phishing-campaign-leverages-trusted-google-cloud-automation-capabilities-to-evade-detection/,"Mon, 22 Dec 2025 12:00:26 +0000",RSS Feed
Check Point,Check Point Infinity Global Services Launches First AI Security Training Courses,rohann@checkpoint.com,https://blog.checkpoint.com/infinity-global-services/check-point-infinity-global-services-launches-first-ai-security-training-courses/,"Thu, 18 Dec 2025 12:00:34 +0000",RSS Feed
