publisher,title,author,url,published_at,source
Palo Alto Networks,Introducing Unit 42 Managed XSIAM 2.0,Sharon Maydar,https://www.paloaltonetworks.com/blog/2026/02/introducing-unit-42-managed-xsiam-2-0/,"Tue, 17 Feb 2026 11:01:04 +0000",RSS Feed
Palo Alto Networks,2026 Unit 42 Global Incident Response Report — Attacks Now 4x Faster,Sam Rubin,https://www.paloaltonetworks.com/blog/2026/02/unit-42-global-ir-report/,"Tue, 17 Feb 2026 11:00:24 +0000",RSS Feed
Palo Alto Networks,When Security Becomes an Afterthought,Dena De Angelo,https://www.paloaltonetworks.com/blog/2026/02/when-security-becomes-an-afterthought/,"Thu, 12 Feb 2026 13:00:38 +0000",RSS Feed
Palo Alto Networks,Introducing Palo Alto Networks Quantum-Safe Security,"Rich Campagna, Richu Channakeshava",https://www.paloaltonetworks.com/blog/2026/01/introducing-quantum-safe-security/,"Tue, 27 Jan 2026 21:19:10 +0000",RSS Feed
Cisco Security,Accelerate Security Operations with Cisco’s New Security-Tuned Model,"Aman Priyanshu, Amin Karbasi, Paul Kassianik",https://blogs.cisco.com/security/accelerate-security-operations-with-ciscos-new-security-tuned-model/,"Thu, 12 Feb 2026 13:00:56 +0000",RSS Feed
Cisco Security,Double Defense: Cisco Secure Firewall 10.0 Confronts Encrypted Traffic and Emerging Attack Challenges,"Vignesh Sathiamoorthy,",https://blogs.cisco.com/security/double-defense-secure-firewall-10-0-confronts-encrypted-traffic-emerging-attack-challenges/,"Wed, 11 Feb 2026 13:00:00 +0000",RSS Feed
Cisco Security,Security Observability Improvements in Cisco Secure Firewall 10.0,"Ron Scott-Adams,",https://blogs.cisco.com/security/security-observability-improvements-in-cisco-secure-firewall-10-0/,"Tue, 10 Feb 2026 13:00:00 +0000",RSS Feed
Cisco Security,Redefining Security for the Agentic Era,"Peter Bailey,",https://blogs.cisco.com/security/redefining-security-for-the-agentic-era/,"Tue, 10 Feb 2026 08:30:00 +0000",RSS Feed
Cisco Security,Black Hat Europe: Enhancing Security Operations With Cisco XDR and Foundation-sec-8b-Instruct LLM,"Piotr Jarzynka,",https://blogs.cisco.com/security/enhancing-security-with-cisco-xdr-foundation-ai/,"Mon, 09 Feb 2026 13:00:14 +0000",RSS Feed
Cisco Security,Black Hat Europe 2025: A Decade of Cisco Security Cloud Innovation,"Jessica (Bair) Oppenheimer,",https://blogs.cisco.com/security/black-hat-europe-2025/,"Mon, 09 Feb 2026 13:00:11 +0000",RSS Feed
CrowdStrike,"Exposing Insider Threats through Data Protection, Identity, and HR Context",Radu-Emanuel Chiscariu - Emilian Duca,https://www.crowdstrike.com/en-us/blog/exposing-insider-threats-through-data-protection-identity-hr-context/,"Feb 18, 2026 00:00:00-0600",RSS Feed
CrowdStrike,Inside the Human-AI Feedback Loop Powering CrowdStrike&rsquo;s Agentic Security,Chris Bowie - Grace Ural - Lucia Stanham,https://www.crowdstrike.com/en-us/blog/inside-the-human-ai-feedback-loop-powering-crowdstrike-agentic-security/,"Feb 10, 2026 00:00:00-0600",RSS Feed
CrowdStrike,February 2026 Patch Tuesday: Six Zero-Days Among 59 CVEs Patched,Falcon Exposure Management Team,https://www.crowdstrike.com/en-us/blog/patch-tuesday-analysis-february-2026/,"Feb 10, 2026 00:00:00-0600",RSS Feed
CrowdStrike,CrowdStrike Is the Only Vendor to Be Named a Customers&rsquo; Choice in 2025 Gartner&reg; Voice of the Customer for External Attack Surface Management,Rona Kedmi,https://www.crowdstrike.com/en-us/blog/crowdstrike-named-only-customers-choice-2025-gartner-voice-of-the-customer-easm/,"Feb 09, 2026 00:00:00-0600",RSS Feed
CrowdStrike,"What Security Teams Need to Know About OpenClaw, the AI Super Agent",Elia Zaitsev,https://www.crowdstrike.com/en-us/blog/what-security-teams-need-to-know-about-openclaw-ai-super-agent/,"Feb 04, 2026 00:00:00-0800",RSS Feed
CrowdStrike,CrowdStrike Named a Customers&rsquo; Choice in 2026 Gartner Peer Insights&trade; Voice of the Customer for Application Security Posture Management Tools,Bhavna B. Sehgal,https://www.crowdstrike.com/en-us/blog/crowdstrike-named-customers-choice-2026-gartner-peer-insights-voice-of-the-customer-for-aspm/,"Feb 03, 2026 00:00:00-0800",RSS Feed
Check Point,Two Types of Threat Intelligence That Make Security Work,rohann@checkpoint.com,https://blog.checkpoint.com/research/two-types-of-threat-intelligence-that-make-security-work/,"Wed, 18 Feb 2026 12:00:26 +0000",RSS Feed
Check Point,Check Point Named Leader in GigaOm Radar for Cloud Network Security For 3 Years in a Row – Protects 22 Cloud Vendors,rohann@checkpoint.com,https://blog.checkpoint.com/securing-the-cloud/check-point-named-leader-in-gigaom-radar-for-cloud-network-security-for-3-years-in-a-row-protects-22-cloud-vendors/,"Tue, 17 Feb 2026 12:00:55 +0000",RSS Feed
Check Point,The UK’s Cyber Threat Has Changed. Most Organizations Haven’t.,rohann@checkpoint.com,https://blog.checkpoint.com/research/the-uks-cyber-threat-has-changed-most-organizations-havent/,"Mon, 16 Feb 2026 12:00:29 +0000",RSS Feed
Check Point,Unzipping the Threat: How to Block Malware Hidden in Password-Protected ZIP Files,rohann@checkpoint.com,https://blog.checkpoint.com/security/unzipping-the-threat-how-to-block-malware-hidden-in-password-protected-zip-files/,"Fri, 13 Feb 2026 12:00:12 +0000",RSS Feed
Check Point,Securing Your AI Transformation: How Check Point Is Helping Security Teams Keep Control in an AI-First World,rohann@checkpoint.com,https://blog.checkpoint.com/innovation/securing-your-ai-transformation-how-check-point-is-helping-security-teams-keep-control-in-an-ai-first-world/,"Thu, 12 Feb 2026 10:02:13 +0000",RSS Feed
Check Point,Love Is in the Air — and So Are Scammers: Valentine’s Day 2026 Threats to Watch For,rohann@checkpoint.com,https://blog.checkpoint.com/research/love-is-in-the-air-and-so-are-scammers-valentines-day-2026-threats-to-watch-for/,"Wed, 11 Feb 2026 15:53:31 +0000",RSS Feed
Check Point,WAF Security Test Results 2026: Why Prevention-First Matters More Than Ever,Unknown,https://blog.checkpoint.com/securing-the-cloud/waf-security-test-results-2026-why-prevention-first-matters-more-than-ever/,"Wed, 11 Feb 2026 12:00:07 +0000",RSS Feed
Check Point,Global Cyber Attacks Rise in January 2026 Amid Increasing Ransomware Activity and Expanding GenAI Risks,Unknown,https://blog.checkpoint.com/research/global-cyber-attacks-rise-in-january-2026-amid-increasing-ransomware-activity-and-expanding-genai-risks/,"Tue, 10 Feb 2026 12:00:52 +0000",RSS Feed
Check Point,From Solo to Squad: The Evolution of Cyber Security Training in the AI Era,anap,https://blog.checkpoint.com/infinity-global-services/from-solo-to-squad-the-evolution-of-cyber-security-training-in-the-ai-era/,"Mon, 09 Feb 2026 12:00:47 +0000",RSS Feed
