company_name,job_title,job_category,location,relevance_score,source_platform,source_url,posted_date,matched_keywords
Startup97,,SaaS Security,"London, UK",0.9,,https://startup97.wd1.myworkdayjobs.com/en-US/careers,,"ai compliance, generative ai compliance, saas security, saas security posture, sspm"
Startup234,,AI Compliance,Remote (US),0.8,,https://startup234.wd1.myworkdayjobs.com/en-US/careers,,"cloud compliance, ai agent risk, ai policy, generative ai compliance"
Rapid7,,SSPM,"New York, NY",0.85,,https://rapid7.wd1.myworkdayjobs.com/en-US/careers,,"cloud compliance, cloud governance, shadow it"
Startup292,,AI Compliance,"New York, NY",0.9,,https://startup292.wd1.myworkdayjobs.com/en-US/careers,,"saas risk, genai security, ai security, generative ai compliance"
Startup344,,AI Agent Security,Remote,0.7,,https://startup344.wd1.myworkdayjobs.com/en-US/careers,,"ai agent security, ai compliance"
Startup225,,AI Agent Security,"San Francisco, CA",0.7,,https://startup225.wd1.myworkdayjobs.com/en-US/careers,,"ai agent security, sanctioned it, ai policy"
Startup306,,SSPM,"Boston, MA",0.85,,https://startup306.wd1.myworkdayjobs.com/en-US/careers,,"sanctioned it, saas posture management, cloud application security"
Proofpoint,,SSPM,"Austin, TX",0.85,,https://proofpoint.wd1.myworkdayjobs.com/en-US/careers,,"saas compliance, genai security, shadow it, security posture management, saas security"
Startup395,,SaaS Security,"London, UK",0.9,,https://startup395.wd1.myworkdayjobs.com/en-US/careers,,"ai agent risk, llm security, saas compliance"
PwC,,SaaS Compliance,"New York, NY",0.85,,https://pwc.wd1.myworkdayjobs.com/en-US/careers,,"saas governance, llm security, ai compliance"
Startup226,,SSPM,"New York, NY",0.85,,https://startup226.wd1.myworkdayjobs.com/en-US/careers,,"saas security posture, sspm, ai compliance"
Startup52,,SaaS Security,"Denver, CO",0.9,,https://startup52.wd1.myworkdayjobs.com/en-US/careers,,"cloud governance, saas governance, saas compliance, genai security, sspm"
Startup395,,SSPM,"Seattle, WA",0.85,,https://startup395.wd1.myworkdayjobs.com/en-US/careers,,"ai agent risk, sanctioned it, cloud governance, saas posture management"
Startup256,,SaaS Compliance,Hybrid - Bay Area,0.85,,https://jobs.ashbyhq.com/startup256,,"saas compliance, ai governance, cloud compliance"
Startup52,,SaaS Compliance,Remote (US),0.7,,https://jobs.ashbyhq.com/startup52,,"llm compliance, cloud governance"
Lockheed Martin,,SSPM,"Austin, TX",0.85,,https://jobs.ashbyhq.com/lockheed-martin,,"ai governance, ai agent risk, sspm, ai policy"
Tenable,,AI Agent Security,Hybrid - Bay Area,0.7,,https://jobs.ashbyhq.com/tenable,,"ai compliance, autonomous agent security"
Startup119,,SSPM,Hybrid - Bay Area,0.85,,https://jobs.ashbyhq.com/startup119,,"ai agent security, saas governance, ai governance, cloud compliance, sspm"
Startup361,,SSPM,Remote,0.85,,https://jobs.ashbyhq.com/startup361,,"sspm, autonomous agent security, cloud governance, generative ai compliance"
Startup377,,SSPM,Remote (US),0.85,,https://jobs.ashbyhq.com/startup377,,"security posture management, saas audit, cloud application security, ai agent security"
Startup15,,SSPM,"Seattle, WA",0.85,,https://jobs.ashbyhq.com/startup15,,"saas security posture, security posture management, cloud application security, generative ai compliance, ai agent security"
Startup223,,SSPM,"Seattle, WA",0.85,,https://jobs.ashbyhq.com/startup223,,"sspm, saas governance, ai agent risk, saas security posture"
Startup242,,SSPM,"Austin, TX",0.85,,https://jobs.ashbyhq.com/startup242,,"saas compliance, saas posture management, ai security"
Startup338,,SaaS Security,"Toronto, Canada",0.7,,https://jobs.ashbyhq.com/startup338,,"ai agent security, shadow it"
Startup39,,AI Compliance,"Boston, MA",0.7,,https://jobs.ashbyhq.com/startup39,,"llm compliance, generative ai compliance"
Startup145,,SaaS Security,"New York, NY",0.85,,https://jobs.ashbyhq.com/startup145,,"cloud application security, saas security"
Best Buy,,SaaS Compliance,"London, UK",0.8,,https://jobs.ashbyhq.com/best-buy,,"ai compliance, saas risk"
ConocoPhillips,,SSPM,"San Francisco, CA",0.85,,https://jobs.ashbyhq.com/conocophillips,,"sanctioned it, saas governance, sspm, saas security posture"
Startup398,,SaaS Security,"Austin, TX",0.8,,https://jobs.ashbyhq.com/startup398,,"llm security, cloud application security, ai governance"
Startup167,,AI Compliance,"Boston, MA",0.8,,https://jobs.ashbyhq.com/startup167,,"generative ai compliance, cloud governance, ai policy"
Startup393,,SSPM,"San Francisco, CA",0.85,,https://jobs.ashbyhq.com/startup393,,"saas security posture, autonomous agent security"
Startup122,,SSPM,Remote,0.85,,https://jobs.ashbyhq.com/startup122,,"saas security posture, shadow it, ai security, saas compliance, ai policy"
Startup273,,SSPM,Hybrid - Bay Area,0.85,,https://jobs.ashbyhq.com/startup273,,"shadow it, saas compliance"
Startup374,,SSPM,"Seattle, WA",0.85,,https://jobs.ashbyhq.com/startup374,,"autonomous agent security, saas audit, sanctioned it, ai agent security, saas posture management"
Startup350,,SSPM,"New York, NY",0.85,,https://jobs.ashbyhq.com/startup350,,"cloud app security, security posture management, saas audit"
Startup112,,SSPM,Hybrid - Bay Area,0.85,,https://jobs.ashbyhq.com/startup112,,"sspm, genai security, ai compliance, shadow it, cloud compliance"
Startup310,,AI Agent Security,"Boston, MA",0.8,,https://jobs.ashbyhq.com/startup310,,"autonomous agent security, ai governance, cloud governance, ai security"
Startup173,,SaaS Compliance,"Denver, CO",0.9,,https://jobs.ashbyhq.com/startup173,,"saas governance, saas compliance, sspm, ai policy, cloud compliance"
Startup29,,SaaS Security,Remote (US),0.9,,https://jobs.ashbyhq.com/startup29,,"ai security, ai policy, saas governance, genai security"
Startup378,,SaaS Security,Remote,0.9,,https://jobs.ashbyhq.com/startup378,,"llm security, generative ai compliance, saas governance, saas risk, security posture management"
Startup217,,SSPM,"Seattle, WA",0.9,,https://jobs.ashbyhq.com/startup217,,"saas posture management, cloud compliance, sanctioned it, saas security posture"
Startup121,,SaaS Security,"Austin, TX",0.9,,https://jobs.ashbyhq.com/startup121,,"cloud governance, cloud compliance, generative ai compliance, sspm, saas governance"
Startup258,,SSPM,"Denver, CO",0.85,,https://jobs.ashbyhq.com/startup258,,"sspm, autonomous agent security, sanctioned it, saas security posture"
Best Buy,,SaaS Compliance,Remote,0.85,,https://jobs.ashbyhq.com/best-buy,,"generative ai compliance, saas security"
Startup126,,SSPM,"New York, NY",0.85,,https://jobs.ashbyhq.com/startup126,,"cloud application security, llm compliance, saas security posture"
Startup146,,SaaS Security,"Austin, TX",0.8,,https://jobs.ashbyhq.com/startup146,,"autonomous agent security, ai security, saas risk"
Startup247,,AI Agent Security,"New York, NY",0.8,,https://jobs.ashbyhq.com/startup247,,"saas risk, ai agent risk, ai governance"
Startup111,,SaaS Security,"Denver, CO",0.85,,https://jobs.ashbyhq.com/startup111,,"ai compliance, saas governance, saas security, shadow it, ai security"
Qualys,,SSPM,"Seattle, WA",0.85,,https://jobs.ashbyhq.com/qualys,,"saas risk, llm compliance"
Startup343,,SSPM,Hybrid - Bay Area,0.85,,https://jobs.ashbyhq.com/startup343,,"saas risk, saas posture management, genai security, cloud application security"
Startup158,,SaaS Security,Remote (US),0.8,,https://jobs.ashbyhq.com/startup158,,"sanctioned it, cloud app security, ai governance, shadow it"
Startup301,,SSPM,"San Francisco, CA",0.85,,https://jobs.ashbyhq.com/startup301,,"ai agent security, cloud app security, cloud governance, saas audit"
Startup7,,SaaS Security,"Toronto, Canada",0.8,,https://jobs.ashbyhq.com/startup7,,"saas risk, autonomous agent security, ai compliance"
Startup236,,AI Agent Security,Hybrid - Bay Area,0.7,,https://jobs.ashbyhq.com/startup236,,"llm security, ai governance, ai agent security"
Startup68,,SSPM,"New York, NY",0.85,,https://jobs.ashbyhq.com/startup68,,"generative ai compliance, genai security, saas posture management, cloud governance"
Startup316,,SaaS Compliance,Remote,0.85,,https://jobs.ashbyhq.com/startup316,,"llm compliance, saas audit, ai policy"
Startup227,,SSPM,"London, UK",0.85,,https://jobs.ashbyhq.com/startup227,,"security posture management, ai policy, cloud application security, saas security posture, ai security"
Startup108,,SaaS Security,"Boston, MA",0.8,,https://jobs.ashbyhq.com/startup108,,"ai security, saas audit, genai security, ai governance"
Startup212,,SSPM,"Austin, TX",0.9,,https://jobs.ashbyhq.com/startup212,,"saas posture management, saas governance, ai compliance, genai security, ai policy"
Walmart,,SaaS Security,"New York, NY",0.85,,https://jobs.ashbyhq.com/walmart,,"cloud application security, llm security, saas risk, genai security"
Intel,,SSPM,Hybrid - Bay Area,0.9,,https://jobs.ashbyhq.com/intel,,"saas posture management, genai security, ai agent security, generative ai compliance"
Startup138,,SaaS Security,"Boston, MA",0.8,,https://jobs.ashbyhq.com/startup138,,"generative ai compliance, cloud governance, ai agent security, shadow it"
Startup289,,SaaS Security,"New York, NY",0.9,,https://jobs.ashbyhq.com/startup289,,"genai security, llm compliance, autonomous agent security, saas governance, cloud app security"
Startup400,,SaaS Compliance,"Denver, CO",0.85,,https://jobs.ashbyhq.com/startup400,,"saas audit, saas compliance, sanctioned it"
Startup187,,SSPM,"Denver, CO",0.85,,https://jobs.ashbyhq.com/startup187,,"sspm, ai compliance, ai policy, saas governance"
Startup398,,SaaS Security,"Seattle, WA",0.8,,https://jobs.ashbyhq.com/startup398,,"cloud compliance, llm security, saas risk"
Startup63,,SaaS Compliance,"San Francisco, CA",0.8,,https://jobs.ashbyhq.com/startup63,,"cloud governance, ai policy, generative ai compliance, saas audit, ai governance"
Startup288,,SaaS Security,"Austin, TX",0.8,,https://jobs.ashbyhq.com/startup288,,"sanctioned it, ai compliance, shadow it, saas governance"
Startup223,,SSPM,"New York, NY",0.9,,https://jobs.ashbyhq.com/startup223,,"security posture management, ai policy, generative ai compliance, ai security, saas audit"
Startup328,,SSPM,"Denver, CO",0.85,,https://jobs.ashbyhq.com/startup328,,"saas compliance, saas posture management, saas risk, ai agent risk"
Startup253,,SSPM,"Denver, CO",0.85,,https://jobs.ashbyhq.com/startup253,,"llm security, ai compliance, autonomous agent security, saas posture management, llm compliance"
Startup275,,AI Agent Security,"London, UK",0.7,,https://jobs.ashbyhq.com/startup275,,"genai security, ai security"
Startup306,,AI Agent Security,"Toronto, Canada",0.7,,https://jobs.ashbyhq.com/startup306,,"ai security, llm security"
Startup200,,SSPM,"Toronto, Canada",0.85,,https://jobs.ashbyhq.com/startup200,,"ai policy, llm security, saas risk, cloud app security"
Startup60,,SSPM,"New York, NY",0.85,,https://jobs.ashbyhq.com/startup60,,"ai agent risk, security posture management, llm compliance, ai policy, sanctioned it"
Qualys,,SSPM,Remote,0.85,,https://jobs.ashbyhq.com/qualys,,"ai policy, sspm"
Startup128,,SSPM,"Denver, CO",0.85,,https://jobs.ashbyhq.com/startup128,,"cloud application security, saas governance, shadow it, security posture management, generative ai compliance"
Startup34,,SSPM,Remote (US),0.9,,https://jobs.ashbyhq.com/startup34,,"autonomous agent security, saas security posture, saas governance, saas posture management, genai security"
Startup62,,SSPM,"San Francisco, CA",0.85,,https://jobs.ashbyhq.com/startup62,,"ai agent security, security posture management, cloud compliance, cloud application security, saas governance"
Startup61,,SaaS Compliance,"New York, NY",0.85,,https://jobs.ashbyhq.com/startup61,,"cloud governance, cloud compliance"
Startup361,,SaaS Compliance,"Seattle, WA",0.9,,https://jobs.ashbyhq.com/startup361,,"saas compliance, generative ai compliance, ai agent risk, saas audit, llm compliance"
Startup293,,SSPM,"Boston, MA",0.85,,https://jobs.ashbyhq.com/startup293,,"security posture management, sanctioned it, saas risk"
Dropbox,,SSPM,"London, UK",0.85,,https://jobs.ashbyhq.com/dropbox,,"ai agent risk, genai security, shadow it, llm security, security posture management"
Humana,,SaaS Compliance,"Austin, TX",0.85,,https://jobs.ashbyhq.com/humana,,"generative ai compliance, ai policy, shadow it, cloud app security"
Startup269,,SSPM,Remote,0.85,,https://jobs.ashbyhq.com/startup269,,"cloud governance, sanctioned it, saas audit, security posture management, ai agent risk"
Startup360,,SSPM,"London, UK",0.85,,https://jobs.ashbyhq.com/startup360,,"llm compliance, cloud app security, saas posture management"
Northrop Grumman,,SaaS Compliance,Hybrid - Bay Area,0.85,,https://jobs.ashbyhq.com/northrop-grumman,,"llm compliance, saas compliance, ai policy"
Startup339,,SaaS Security,"London, UK",0.7,,https://jobs.ashbyhq.com/startup339,,"cloud governance, ai agent risk"
Startup174,,SaaS Security,"New York, NY",0.8,,https://jobs.ashbyhq.com/startup174,,"cloud app security, ai agent risk"
Startup234,,SSPM,"New York, NY",0.85,,https://jobs.ashbyhq.com/startup234,,"shadow it, saas risk, sanctioned it, sspm, ai agent risk"
Startup250,,SaaS Security,"San Francisco, CA",0.85,,https://jobs.ashbyhq.com/startup250,,"llm compliance, saas security, saas risk"
Startup333,,SaaS Security,Remote (US),0.8,,https://jobs.ashbyhq.com/startup333,,"genai security, sanctioned it, saas governance"
Zoom,,SSPM,"Boston, MA",0.85,,https://jobs.ashbyhq.com/zoom,,"cloud compliance, autonomous agent security"
Startup277,,SaaS Security,"Boston, MA",0.9,,https://jobs.ashbyhq.com/startup277,,"ai policy, saas security, saas compliance, sanctioned it, sspm"
Startup145,,SSPM,"Toronto, Canada",0.85,,https://jobs.ashbyhq.com/startup145,,"saas security posture, ai agent risk"
Startup95,,SaaS Security,"Toronto, Canada",0.85,,https://jobs.ashbyhq.com/startup95,,"ai governance, saas security"
Startup383,,AI Agent Security,"Denver, CO",0.8,,https://jobs.ashbyhq.com/startup383,,"llm security, cloud governance, ai governance, ai security, genai security"
Startup226,,SSPM,"Boston, MA",0.85,,https://jobs.ashbyhq.com/startup226,,"cloud app security, cloud compliance, security posture management, saas audit"
Capital One,,SSPM,"London, UK",0.85,,https://jobs.ashbyhq.com/capital-one,,"saas audit, cloud compliance, ai governance, sspm"
Startup179,,SSPM,"New York, NY",0.85,,https://jobs.ashbyhq.com/startup179,,"ai agent security, saas posture management, saas risk"
Microsoft,,SaaS Compliance,"Denver, CO",0.9,,https://jobs.ashbyhq.com/microsoft,,"autonomous agent security, llm compliance, saas compliance, saas risk, cloud app security"
Startup157,,SSPM,Hybrid - Bay Area,0.85,,https://jobs.ashbyhq.com/startup157,,"security posture management, saas compliance, ai governance, saas security, ai security"
Startup93,,SaaS Security,"Seattle, WA",0.85,,https://jobs.ashbyhq.com/startup93,,"ai agent security, cloud application security, ai compliance, ai agent risk, saas risk"
Startup128,,SaaS Security,Remote (US),0.8,,https://jobs.ashbyhq.com/startup128,,"ai agent security, cloud app security"
Startup60,,SSPM,"Toronto, Canada",0.85,,https://jobs.ashbyhq.com/startup60,,"saas audit, sspm, saas compliance, cloud governance"
Startup155,,SSPM,"San Francisco, CA",0.85,,https://jobs.ashbyhq.com/startup155,,"sspm, security posture management, llm security, genai security, saas risk"
Startup256,,SSPM,Hybrid - Bay Area,0.85,,https://jobs.ashbyhq.com/startup256,,"shadow it, saas risk, llm compliance, llm security"
CrowdStrike,,AI Agent Security,"Austin, TX",0.8,,https://jobs.ashbyhq.com/crowdstrike,,"llm compliance, autonomous agent security"
McKinsey,,SSPM,"Austin, TX",0.85,,https://jobs.ashbyhq.com/mckinsey,,"shadow it, ai compliance, autonomous agent security, sspm"
Startup182,,SaaS Security,"New York, NY",0.85,,https://jobs.ashbyhq.com/startup182,,"saas security, cloud application security, saas risk"
Startup396,,SSPM,"Seattle, WA",0.85,,https://jobs.ashbyhq.com/startup396,,"llm security, sanctioned it, llm compliance, saas posture management, saas security posture"
Startup39,,SaaS Security,"London, UK",0.85,,https://jobs.ashbyhq.com/startup39,,"autonomous agent security, ai policy, cloud app security, saas security posture"
McAfee,,AI Compliance,"Seattle, WA",0.85,,https://jobs.ashbyhq.com/mcafee,,"generative ai compliance, ai policy, genai security, cloud governance"
Startup400,,SaaS Security,Remote,0.85,,https://www.indeed.com/q-cloud-posture-engineer-startup400-jobs.html,,"cloud app security, generative ai compliance, saas governance, ai security"
Startup15,,AI Agent Security,"Austin, TX",0.7,,https://www.indeed.com/q-compliance-engineer-startup15-jobs.html,,"llm security, ai agent risk"
Startup176,,SSPM,"San Francisco, CA",0.85,,https://www.indeed.com/q-ai-agent-security-engineer-startup176-jobs.html,,"saas security, saas security posture, llm security, saas audit, shadow it"
Google,,AI Agent Security,"Austin, TX",0.8,,https://www.indeed.com/q-ai-security-engineer-google-jobs.html,,"ai agent security, cloud compliance, ai policy"
Startup98,,SaaS Security,"Denver, CO",0.85,,https://www.indeed.com/q-senior-security-engineer-startup98-jobs.html,,"saas security, ai agent risk, shadow it"
BAE Systems,,SSPM,"San Francisco, CA",0.85,,https://www.indeed.com/q-llm-security-specialist-bae-systems-jobs.html,,"cloud app security, ai security, sspm, saas governance"
Startup316,,SSPM,Hybrid - Bay Area,0.85,,https://www.indeed.com/q-security-manager-startup316-jobs.html,,"llm security, ai agent risk, shadow it, saas audit, cloud governance"
Startup379,,SSPM,"New York, NY",0.85,,https://www.indeed.com/q-threat-detection-engineer-startup379-jobs.html,,"llm compliance, autonomous agent security, saas posture management"
Cisco,,SaaS Compliance,"Toronto, Canada",0.9,,https://www.indeed.com/q-security-operations-engineer-cisco-jobs.html,,"ai compliance, cloud governance, llm compliance, generative ai compliance, cloud application security"
Startup263,,SaaS Security,Hybrid - Bay Area,0.9,,https://www.indeed.com/q-compliance-engineer-startup263-jobs.html,,"ai agent security, cloud application security, saas compliance, ai policy, genai security"
Startup103,,SSPM,"New York, NY",0.85,,https://www.indeed.com/q-security-compliance-manager-startup103-jobs.html,,"ai security, saas security posture, saas posture management"
Trend Micro,,SSPM,"Toronto, Canada",0.85,,https://www.indeed.com/q-director-of-security-trend-micro-jobs.html,,"sspm, saas security, cloud application security, saas governance, genai security"
Startup41,,AI Agent Security,"Austin, TX",0.7,,https://www.indeed.com/q-cloud-security-architect-startup41-jobs.html,,"sanctioned it, ai governance, ai security, ai agent security"
Startup374,,SaaS Compliance,"San Francisco, CA",0.85,,https://www.indeed.com/q-grc-analyst-startup374-jobs.html,,"saas compliance, generative ai compliance, cloud app security"
Startup355,,SaaS Security,"Boston, MA",0.8,,https://www.indeed.com/q-senior-security-engineer-startup355-jobs.html,,"saas risk, llm compliance, ai agent risk"
Startup39,,SaaS Compliance,"Austin, TX",0.8,,https://www.indeed.com/q-security-manager-startup39-jobs.html,,"sanctioned it, saas compliance, cloud compliance"
Startup306,,SaaS Security,"Seattle, WA",0.8,,https://www.indeed.com/q-ciso-startup306-jobs.html,,"ai governance, cloud application security, sanctioned it"
Startup42,,SSPM,"Boston, MA",0.85,,https://www.indeed.com/q-cloud-security-architect-startup42-jobs.html,,"cloud governance, shadow it, saas governance"
VMware,,SaaS Security,Remote,0.85,,https://www.indeed.com/q-ai-security-engineer-vmware-jobs.html,,"cloud application security, autonomous agent security, ai compliance"
Verizon,,SSPM,"London, UK",0.85,,https://www.indeed.com/q-appsec-engineer-verizon-jobs.html,,"saas security, sanctioned it"
Startup375,,SSPM,Hybrid - Bay Area,0.85,,https://www.indeed.com/q-application-security-engineer-startup375-jobs.html,,"ai policy, saas audit, shadow it"
Startup186,,SSPM,"Boston, MA",0.85,,https://www.indeed.com/q-vp-of-security-startup186-jobs.html,,"saas posture management, ai agent security"
Startup268,,SSPM,"Toronto, Canada",0.85,,https://www.indeed.com/q-security-manager-startup268-jobs.html,,"cloud governance, saas risk"
Startup233,,SSPM,"New York, NY",0.85,,https://www.indeed.com/q-director-of-security-startup233-jobs.html,,"sspm, cloud app security, saas security posture, shadow it"
Startup320,,SSPM,"Austin, TX",0.85,,https://www.indeed.com/q-senior-security-engineer-startup320-jobs.html,,"llm security, saas posture management, autonomous agent security"
Startup151,,SaaS Security,"London, UK",0.85,,https://www.indeed.com/q-security-operations-engineer-startup151-jobs.html,,"generative ai compliance, saas security, cloud governance, ai agent security, llm compliance"
Startup76,,SSPM,Hybrid - Bay Area,0.85,,https://www.indeed.com/q-application-security-engineer-startup76-jobs.html,,"saas security posture, sanctioned it"
Startup209,,SaaS Security,"Seattle, WA",0.85,,https://www.indeed.com/q-security-team-lead-startup209-jobs.html,,"sanctioned it, cloud application security, saas security, cloud app security"
Startup48,,SaaS Security,"San Francisco, CA",0.85,,https://www.indeed.com/q-sspm-engineer-startup48-jobs.html,,"cloud app security, saas governance, ai policy, llm security"
Startup155,,SSPM,"San Francisco, CA",0.85,,https://www.indeed.com/q-security-analyst-startup155-jobs.html,,"saas audit, cloud compliance, saas governance, security posture management"
Deloitte,,SSPM,"Seattle, WA",0.85,,https://www.indeed.com/q-incident-response-engineer-deloitte-jobs.html,,"cloud app security, saas posture management, saas security posture, genai security"
Startup38,,SaaS Security,Remote,0.9,,https://www.indeed.com/q-security-operations-engineer-startup38-jobs.html,,"saas risk, generative ai compliance, cloud application security, saas security posture, autonomous agent security"
Startup318,,SSPM,"London, UK",0.85,,https://www.indeed.com/q-incident-response-engineer-startup318-jobs.html,,"cloud governance, ai agent risk, saas governance, saas audit"
Startup83,,SaaS Security,Remote,0.9,,https://www.indeed.com/q-saas-security-posture-manager-startup83-jobs.html,,"ai governance, sspm, llm compliance, saas security"
Startup201,,SaaS Compliance,"Austin, TX",0.8,,https://www.indeed.com/q-saas-security-architect-startup201-jobs.html,,"ai compliance, cloud compliance, cloud app security"
Northrop Grumman,,AI Compliance,"Denver, CO",0.9,,https://www.indeed.com/q-security-software-engineer-northrop-grumman-jobs.html,,"cloud governance, ai governance, generative ai compliance, genai security, llm compliance"
Startup224,,SSPM,"Boston, MA",0.85,,https://www.indeed.com/q-application-security-engineer-startup224-jobs.html,,"saas posture management, sspm, saas security, genai security"
Startup214,,SSPM,"Seattle, WA",0.85,,https://www.indeed.com/q-compliance-engineer-startup214-jobs.html,,"cloud app security, sspm, sanctioned it, shadow it"
Startup343,,AI Compliance,Remote (US),0.9,,https://www.indeed.com/q-security-engineer-startup343-jobs.html,,"ai compliance, ai agent security, sspm, generative ai compliance, llm compliance"
Startup325,,SaaS Security,Remote (US),0.9,,https://www.indeed.com/q-saas-security-posture-manager-startup325-jobs.html,,"llm compliance, genai security, ai policy, cloud app security, saas risk"
Startup210,,SSPM,Remote (US),0.85,,https://www.indeed.com/q-security-compliance-manager-startup210-jobs.html,,"autonomous agent security, saas compliance, sspm"
Startup167,,SSPM,"Toronto, Canada",0.85,,https://www.indeed.com/q-grc-analyst-startup167-jobs.html,,"saas governance, saas posture management, security posture management"
Startup320,,SaaS Security,"Denver, CO",0.9,,https://www.indeed.com/q-director-of-security-startup320-jobs.html,,"cloud application security, saas security posture, autonomous agent security, ai agent security"
Startup114,,SaaS Security,"Austin, TX",0.9,,https://www.indeed.com/q-saas-security-posture-manager-startup114-jobs.html,,"cloud application security, sspm, autonomous agent security, saas compliance, generative ai compliance"
Startup244,,SSPM,Remote (US),0.85,,https://www.indeed.com/q-machine-learning-security-engineer-startup244-jobs.html,,"saas posture management, cloud app security, ai policy"
Startup231,,SSPM,"Seattle, WA",0.85,,https://www.indeed.com/q-security-manager-startup231-jobs.html,,"cloud governance, saas governance, cloud application security, ai agent risk"
Startup212,,SaaS Security,"Seattle, WA",0.9,,https://www.indeed.com/q-security-posture-analyst-startup212-jobs.html,,"ai governance, saas security, saas posture management, genai security, cloud application security"
Startup249,,SaaS Compliance,Remote,0.8,,https://www.indeed.com/q-lead-security-engineer-startup249-jobs.html,,"generative ai compliance, ai compliance, saas governance"
Startup244,,SSPM,"Boston, MA",0.85,,https://www.indeed.com/q-threat-detection-engineer-startup244-jobs.html,,"saas security posture, cloud governance, cloud application security"
Microsoft,,SSPM,"Denver, CO",0.85,,https://www.indeed.com/q-grc-analyst-microsoft-jobs.html,,"saas governance, ai agent risk, saas audit, ai governance"
Startup229,,SSPM,Remote,0.85,,https://www.indeed.com/q-security-auditor-startup229-jobs.html,,"saas risk, sspm"
Startup387,,SSPM,Hybrid - Bay Area,0.85,,https://www.indeed.com/q-security-engineer-startup387-jobs.html,,"saas risk, security posture management"
Lacework,,SSPM,"San Francisco, CA",0.9,,https://www.indeed.com/q-saas-security-engineer-lacework-jobs.html,,"security posture management, saas posture management, sspm, saas compliance, cloud governance"
