company_name,job_title,job_category,location,relevance_score,source_platform,source_url,posted_date,matched_keywords
Startup205,,SaaS Compliance,Hybrid - Bay Area,0.7,,https://www.ycombinator.com/companies/industry/security,,"cloud compliance, ai policy"
Startup133,,SSPM,"New York, NY",0.85,,https://www.ycombinator.com/companies/industry/security,,"cloud app security, saas posture management, ai security"
Startup81,,SSPM,"Austin, TX",0.9,,https://www.ycombinator.com/companies/industry/security,,"ai compliance, sspm, saas posture management, llm security, cloud compliance"
Startup252,,SaaS Security,Remote (US),0.9,,https://www.ycombinator.com/companies/industry/security,,"llm compliance, genai security, security posture management, saas compliance"
Startup18,,SSPM,"Austin, TX",0.85,,https://www.ycombinator.com/companies/industry/security,,"generative ai compliance, security posture management, sanctioned it, cloud compliance"
Startup151,,AI Compliance,Hybrid - Bay Area,0.85,,https://www.ycombinator.com/companies/industry/security,,"saas risk, genai security, ai compliance, llm security"
Startup190,,SSPM,"New York, NY",0.9,,https://www.ycombinator.com/companies/industry/security,,"saas security posture, saas audit, llm security, saas posture management, saas compliance"
Startup227,,SSPM,"Austin, TX",0.85,,https://www.ycombinator.com/companies/industry/security,,"saas audit, cloud app security, sanctioned it, cloud compliance, ai agent risk"
Workday,,SSPM,"Toronto, Canada",0.85,,https://www.ycombinator.com/companies/industry/security,,"shadow it, ai agent security, cloud app security"
Startup190,,SaaS Security,"Seattle, WA",0.9,,https://www.ycombinator.com/companies/industry/security,,"cloud compliance, saas security, autonomous agent security, cloud app security"
Startup242,,SSPM,"Boston, MA",0.85,,https://www.ycombinator.com/companies/industry/security,,"ai agent security, security posture management, cloud governance"
Proofpoint,,SaaS Security,"London, UK",0.8,,https://www.ycombinator.com/companies/industry/security,,"ai agent risk, sanctioned it, cloud compliance"
Startup312,,SSPM,"London, UK",0.85,,https://www.ycombinator.com/companies/industry/security,,"ai security, ai compliance, saas governance, sspm"
Tenable,,SSPM,"Austin, TX",0.85,,https://www.ycombinator.com/companies/industry/security,,"saas governance, saas security posture, saas risk, saas posture management, ai agent risk"
Startup375,,SSPM,"Toronto, Canada",0.85,,https://www.ycombinator.com/companies/industry/security,,"security posture management, saas governance, ai agent risk"
Startup400,,SaaS Security,"Seattle, WA",0.9,,https://www.ycombinator.com/companies/industry/security,,"ai security, saas security, llm security, cloud app security"
Startup209,,SaaS Security,Remote,0.8,,https://www.ycombinator.com/companies/industry/security,,"saas governance, llm security"
Startup178,,SaaS Security,"Seattle, WA",0.85,,https://www.ycombinator.com/companies/industry/security,,"genai security, saas compliance, cloud app security, saas security posture, shadow it"
Startup46,,AI Agent Security,"Seattle, WA",0.8,,https://www.ycombinator.com/companies/industry/security,,"sanctioned it, autonomous agent security, generative ai compliance, llm security"
Startup368,,SaaS Compliance,"San Francisco, CA",0.8,,https://www.ycombinator.com/companies/industry/security,,"cloud governance, cloud compliance, ai compliance, llm security"
Startup362,,SSPM,"London, UK",0.9,,https://www.ycombinator.com/companies/industry/security,,"saas posture management, llm compliance, saas security, genai security, ai security"
Startup254,,SSPM,Hybrid - Bay Area,0.85,,https://www.ycombinator.com/companies/industry/security,,"genai security, sspm"
Startup75,,SSPM,Remote (US),0.85,,https://www.ycombinator.com/companies/industry/security,,"ai policy, sanctioned it, saas audit, security posture management"
Startup266,,SSPM,"San Francisco, CA",0.9,,https://www.ycombinator.com/companies/industry/security,,"ai compliance, llm security, saas audit, sspm, cloud application security"
Deloitte,,SSPM,"New York, NY",0.85,,https://www.ycombinator.com/companies/industry/security,,"saas audit, cloud application security"
Startup60,,SaaS Compliance,"Boston, MA",0.85,,https://www.ycombinator.com/companies/industry/security,,"llm compliance, generative ai compliance, saas security posture"
Startup58,,SSPM,"Boston, MA",0.85,,https://www.ycombinator.com/companies/industry/security,,"sspm, saas security, saas risk"
Microsoft,,AI Agent Security,"Austin, TX",0.85,,https://www.ycombinator.com/companies/industry/security,,"ai governance, ai agent risk, ai agent security, saas governance, autonomous agent security"
Startup332,,SSPM,"Seattle, WA",0.85,,https://www.ycombinator.com/companies/industry/security,,"cloud compliance, saas governance, security posture management"
Zoom,,SSPM,Hybrid - Bay Area,0.85,,https://www.ycombinator.com/companies/industry/security,,"ai agent risk, cloud compliance"
Startup188,,SSPM,Hybrid - Bay Area,0.85,,https://www.ycombinator.com/companies/industry/security,,"security posture management, llm security"
Startup376,,SaaS Security,Hybrid - Bay Area,0.85,,https://www.ycombinator.com/companies/industry/security,,"cloud app security, saas risk, ai compliance"
Startup154,,SaaS Compliance,"New York, NY",0.9,,https://www.ycombinator.com/companies/industry/security,,"llm compliance, generative ai compliance, saas risk, cloud compliance, security posture management"
Startup388,,SaaS Security,Remote,0.7,,https://www.ycombinator.com/companies/industry/security,,"autonomous agent security, cloud governance"
Startup326,,SSPM,"London, UK",0.85,,https://www.ycombinator.com/companies/industry/security,,"saas governance, shadow it"
Startup259,,AI Compliance,"Toronto, Canada",0.8,,https://www.ycombinator.com/companies/industry/security,,"ai compliance, llm security, ai security"
Startup363,,SaaS Compliance,"Toronto, Canada",0.85,,https://www.ycombinator.com/companies/industry/security,,"sanctioned it, saas audit, saas compliance"
Startup246,,SSPM,"Boston, MA",0.85,,https://www.ycombinator.com/companies/industry/security,,"ai agent risk, saas posture management"
Startup53,,SaaS Security,Remote,0.7,,https://www.ycombinator.com/companies/industry/security,,"saas risk, ai governance"
Startup147,,AI Compliance,"Austin, TX",0.9,,https://www.ycombinator.com/companies/industry/security,,"generative ai compliance, llm compliance"
Startup261,,SaaS Security,"Austin, TX",0.8,,https://www.ycombinator.com/companies/industry/security,,"cloud application security, ai compliance"
Startup200,,SSPM,"London, UK",0.85,,https://www.ycombinator.com/companies/industry/security,,"saas posture management, ai agent security, saas risk"
Orca Security,,SSPM,"Toronto, Canada",0.9,,https://www.ycombinator.com/companies/industry/security,,"generative ai compliance, saas posture management, llm compliance, llm security"
Startup100,,SSPM,Remote (US),0.85,,https://www.ycombinator.com/companies/industry/security,,"cloud application security, ai agent risk, sspm"
Startup46,,SSPM,Hybrid - Bay Area,0.9,,https://www.ycombinator.com/companies/industry/security,,"security posture management, ai agent risk, sspm, saas audit, saas security posture"
Check Point,,SSPM,"Toronto, Canada",0.85,,https://www.ycombinator.com/companies/industry/security,,"ai governance, ai security, sspm"
Startup63,,AI Agent Security,"Austin, TX",0.8,,https://www.ycombinator.com/companies/industry/security,,"genai security, shadow it, ai agent security"
Startup93,,SaaS Security,"San Francisco, CA",0.8,,https://www.ycombinator.com/companies/industry/security,,"saas risk, autonomous agent security"
Startup117,,AI Agent Security,"Denver, CO",0.7,,https://www.ycombinator.com/companies/industry/security,,"shadow it, ai policy, ai agent risk"
Startup45,,SSPM,"Boston, MA",0.85,,https://www.ycombinator.com/companies/industry/security,,"saas security, saas compliance, ai compliance, sspm, llm security"
Startup325,,SaaS Security,"Denver, CO",0.85,,https://www.ycombinator.com/companies/industry/security,,"sanctioned it, genai security, ai agent security, ai policy, saas security"
Startup327,,SSPM,Remote (US),0.85,,https://www.ycombinator.com/companies/industry/security,,"ai security, saas posture management, security posture management, sspm, genai security"
BCG,,SSPM,Remote (US),0.85,,https://www.ycombinator.com/companies/industry/security,,"ai agent risk, saas audit, saas posture management"
Startup73,,SSPM,"New York, NY",0.85,,https://www.ycombinator.com/companies/industry/security,,"ai compliance, cloud governance, saas security posture"
Startup133,,SSPM,"New York, NY",0.85,,https://www.ycombinator.com/companies/industry/security,,"cloud app security, saas audit"
Startup219,,SSPM,"Toronto, Canada",0.85,,https://www.ycombinator.com/companies/industry/security,,"cloud governance, saas audit"
CloudKnox,,SaaS Security,"Toronto, Canada",0.8,,https://www.ycombinator.com/companies/industry/security,,"ai security, sanctioned it, ai agent risk, genai security, saas audit"
McAfee,,SaaS Security,"Austin, TX",0.8,,https://www.ycombinator.com/companies/industry/security,,"ai agent risk, saas audit, sanctioned it"
Sysdig,,SSPM,"San Francisco, CA",0.85,,https://www.ycombinator.com/companies/industry/security,,"saas compliance, security posture management, saas security posture, saas governance, llm security"
Startup175,,SSPM,"Seattle, WA",0.85,,https://www.ycombinator.com/companies/industry/security,,"saas compliance, sspm, ai agent risk, sanctioned it, cloud governance"
BAE Systems,,SSPM,"London, UK",0.85,,https://www.ycombinator.com/companies/industry/security,,"shadow it, sspm"
Startup338,,SaaS Security,"New York, NY",0.9,,https://www.ycombinator.com/companies/industry/security,,"shadow it, ai agent risk, cloud application security, generative ai compliance"
DocuSign,,SSPM,Hybrid - Bay Area,0.85,,https://www.ycombinator.com/companies/industry/security,,"cloud app security, security posture management"
Startup69,,SSPM,"Toronto, Canada",0.85,,https://www.ycombinator.com/companies/industry/security,,"sspm, saas compliance, ai agent security"
Startup258,,SaaS Security,"Boston, MA",0.85,,https://www.ycombinator.com/companies/industry/security,,"cloud application security, cloud app security, cloud compliance"
Startup13,,AI Compliance,"San Francisco, CA",0.85,,https://www.ycombinator.com/companies/industry/security,,"ai policy, saas governance, generative ai compliance, ai agent risk, ai security"
Startup362,,SaaS Compliance,"New York, NY",0.9,,https://www.ycombinator.com/companies/industry/security,,"ai agent risk, saas audit, generative ai compliance"
Startup108,,SaaS Security,"London, UK",0.9,,https://www.ycombinator.com/companies/industry/security,,"saas security posture, ai agent risk, ai compliance, saas compliance"
Startup149,,SSPM,"London, UK",0.85,,https://www.ycombinator.com/companies/industry/security,,"saas security, saas security posture, cloud compliance, ai compliance"
Startup243,,SaaS Security,"New York, NY",0.85,,https://www.ycombinator.com/companies/industry/security,,"saas governance, saas security, ai governance"
Aqua Security,,SaaS Security,Hybrid - Bay Area,0.85,,https://www.ycombinator.com/companies/industry/security,,"ai security, saas governance, autonomous agent security"
Fortinet,,SSPM,"Boston, MA",0.85,,https://www.ycombinator.com/companies/industry/security,,"ai governance, saas security posture"
Startup281,,SSPM,Remote (US),0.85,,https://www.ycombinator.com/companies/industry/security,,"genai security, saas audit, saas posture management"
Startup13,,AI Agent Security,Remote,0.8,,https://www.ycombinator.com/companies/industry/security,,"cloud governance, genai security, llm security"
Startup148,,SaaS Security,"London, UK",0.85,,https://startup148.wd1.myworkdayjobs.com/en-US/careers,,"ai agent risk, saas audit, saas risk, cloud app security"
Startup52,,SaaS Security,"Austin, TX",0.9,,https://startup52.wd1.myworkdayjobs.com/en-US/careers,,"llm compliance, autonomous agent security, saas risk, security posture management, saas compliance"
Startup165,,SaaS Compliance,Remote,0.85,,https://startup165.wd1.myworkdayjobs.com/en-US/careers,,"ai compliance, cloud compliance, saas audit"
Proofpoint,,SSPM,Remote (US),0.85,,https://proofpoint.wd1.myworkdayjobs.com/en-US/careers,,"saas audit, saas risk, ai agent security"
Startup80,,SaaS Compliance,"New York, NY",0.9,,https://startup80.wd1.myworkdayjobs.com/en-US/careers,,"generative ai compliance, shadow it, autonomous agent security, saas compliance"
Startup324,,SSPM,"San Francisco, CA",0.85,,https://startup324.wd1.myworkdayjobs.com/en-US/careers,,"saas risk, saas security posture, security posture management, shadow it, llm security"
Startup371,,AI Compliance,"Seattle, WA",0.9,,https://startup371.wd1.myworkdayjobs.com/en-US/careers,,"cloud application security, ai governance, autonomous agent security, generative ai compliance"
Startup123,,SSPM,"Denver, CO",0.85,,https://startup123.wd1.myworkdayjobs.com/en-US/careers,,"shadow it, cloud governance, cloud compliance"
Startup200,,SSPM,"London, UK",0.85,,https://startup200.wd1.myworkdayjobs.com/en-US/careers,,"cloud governance, ai policy, saas audit"
Startup130,,SaaS Compliance,Remote (US),0.7,,https://startup130.wd1.myworkdayjobs.com/en-US/careers,,"cloud compliance, ai agent risk"
Charter,,SSPM,"New York, NY",0.85,,https://charter.wd1.myworkdayjobs.com/en-US/careers,,"saas audit, shadow it, saas security posture"
Tenable,,SaaS Security,Hybrid - Bay Area,0.8,,https://tenable.wd1.myworkdayjobs.com/en-US/careers,,"ai agent risk, shadow it, cloud governance, ai policy"
Startup199,,SaaS Security,"Denver, CO",0.8,,https://startup199.wd1.myworkdayjobs.com/en-US/careers,,"cloud app security, ai governance, cloud application security"
Apple,,SSPM,Hybrid - Bay Area,0.85,,https://apple.wd1.myworkdayjobs.com/en-US/careers,,"generative ai compliance, ai compliance, saas posture management"
Startup59,,SSPM,"San Francisco, CA",0.85,,https://startup59.wd1.myworkdayjobs.com/en-US/careers,,"security posture management, ai security, saas security, ai agent risk, cloud governance"
Google,,SaaS Security,Remote,0.8,,https://google.wd1.myworkdayjobs.com/en-US/careers,,"genai security, cloud governance"
Startup370,,SSPM,"Toronto, Canada",0.85,,https://startup370.wd1.myworkdayjobs.com/en-US/careers,,"security posture management, autonomous agent security, saas risk, llm compliance, cloud compliance"
Startup21,,SaaS Security,"New York, NY",0.9,,https://startup21.wd1.myworkdayjobs.com/en-US/careers,,"ai agent risk, llm security, saas governance, saas security, saas risk"
Startup279,,SSPM,"Denver, CO",0.85,,https://startup279.wd1.myworkdayjobs.com/en-US/careers,,"saas posture management, saas audit"
Startup192,,SSPM,"Austin, TX",0.9,,https://startup192.wd1.myworkdayjobs.com/en-US/careers,,"saas governance, ai security, llm compliance, saas posture management, saas audit"
Startup59,,SaaS Compliance,Remote,0.9,,https://startup59.wd1.myworkdayjobs.com/en-US/careers,,"saas audit, ai compliance, sspm, saas compliance, llm compliance"
Chevron,,SSPM,"Austin, TX",0.85,,https://chevron.wd1.myworkdayjobs.com/en-US/careers,,"sspm, saas audit, ai security"
Startup389,,SaaS Compliance,"London, UK",0.8,,https://startup389.wd1.myworkdayjobs.com/en-US/careers,,"ai policy, saas compliance"
Startup63,,AI Compliance,"New York, NY",0.8,,https://startup63.wd1.myworkdayjobs.com/en-US/careers,,"llm compliance, shadow it, ai security"
Startup61,,SSPM,Remote (US),0.85,,https://startup61.wd1.myworkdayjobs.com/en-US/careers,,"saas security posture, saas risk"
Startup399,,AI Agent Security,"Toronto, Canada",0.7,,https://startup399.wd1.myworkdayjobs.com/en-US/careers,,"ai governance, sanctioned it, ai agent security"
Apple,,AI Compliance,"Denver, CO",0.7,,https://apple.wd1.myworkdayjobs.com/en-US/careers,,"sanctioned it, llm compliance, ai compliance"
Startup112,,SSPM,"Seattle, WA",0.85,,https://startup112.wd1.myworkdayjobs.com/en-US/careers,,"saas security posture, shadow it, cloud application security"
Startup392,,SSPM,"Boston, MA",0.85,,https://startup392.wd1.myworkdayjobs.com/en-US/careers,,"ai agent risk, sspm, cloud compliance, saas risk, cloud governance"
Startup124,,SSPM,"Austin, TX",0.85,,https://startup124.wd1.myworkdayjobs.com/en-US/careers,,"sspm, shadow it, genai security"
Startup294,,SaaS Security,"Toronto, Canada",0.85,,https://startup294.wd1.myworkdayjobs.com/en-US/careers,,"saas audit, genai security, saas security"
Adobe,,SaaS Security,"Toronto, Canada",0.85,,https://adobe.wd1.myworkdayjobs.com/en-US/careers,,"ai agent security, cloud governance, saas compliance, ai agent risk"
Startup38,,SaaS Security,"San Francisco, CA",0.85,,https://startup38.wd1.myworkdayjobs.com/en-US/careers,,"llm security, ai agent risk, saas governance"
Startup50,,SaaS Security,Remote (US),0.9,,https://startup50.wd1.myworkdayjobs.com/en-US/careers,,"saas security, sspm, autonomous agent security, saas governance, generative ai compliance"
Startup380,,SSPM,Remote (US),0.85,,https://startup380.wd1.myworkdayjobs.com/en-US/careers,,"saas posture management, generative ai compliance, ai agent security"
Startup150,,SSPM,Hybrid - Bay Area,0.85,,https://startup150.wd1.myworkdayjobs.com/en-US/careers,,"saas posture management, generative ai compliance, cloud compliance"
Startup27,,AI Agent Security,Remote,0.8,,https://startup27.wd1.myworkdayjobs.com/en-US/careers,,"ai policy, llm security, genai security"
Startup13,,SaaS Security,Hybrid - Bay Area,0.8,,https://startup13.wd1.myworkdayjobs.com/en-US/careers,,"saas governance, llm security"
Startup368,,SSPM,"New York, NY",0.85,,https://startup368.wd1.myworkdayjobs.com/en-US/careers,,"saas security posture, saas audit"
Startup61,,SSPM,"New York, NY",0.85,,https://startup61.wd1.myworkdayjobs.com/en-US/careers,,"shadow it, autonomous agent security, generative ai compliance"
Startup372,,SSPM,"Boston, MA",0.85,,https://startup372.wd1.myworkdayjobs.com/en-US/careers,,"saas posture management, sspm, genai security"
Startup41,,AI Compliance,"London, UK",0.9,,https://startup41.wd1.myworkdayjobs.com/en-US/careers,,"generative ai compliance, llm security"
Startup203,,AI Compliance,Hybrid - Bay Area,0.9,,https://startup203.wd1.myworkdayjobs.com/en-US/careers,,"ai policy, generative ai compliance, llm compliance"
Best Buy,,SSPM,Remote,0.85,,https://best-buy.wd1.myworkdayjobs.com/en-US/careers,,"sspm, security posture management, saas risk, genai security, saas security"
Startup208,,SSPM,"Denver, CO",0.9,,https://startup208.wd1.myworkdayjobs.com/en-US/careers,,"sspm, shadow it, saas compliance, llm compliance, cloud compliance"
Startup123,,SSPM,"New York, NY",0.85,,https://startup123.wd1.myworkdayjobs.com/en-US/careers,,"llm compliance, security posture management, saas posture management"
Adobe,,SSPM,"London, UK",0.85,,https://adobe.wd1.myworkdayjobs.com/en-US/careers,,"shadow it, saas posture management, generative ai compliance, cloud compliance"
Startup102,,SSPM,"Denver, CO",0.85,,https://startup102.wd1.myworkdayjobs.com/en-US/careers,,"cloud app security, saas security posture, sspm, saas governance"
Startup361,,AI Compliance,"San Francisco, CA",0.8,,https://startup361.wd1.myworkdayjobs.com/en-US/careers,,"shadow it, llm compliance, ai agent risk, ai policy"
Startup42,,SaaS Security,"Austin, TX",0.9,,https://startup42.wd1.myworkdayjobs.com/en-US/careers,,"ai security, saas security, saas posture management, genai security"
Startup310,,SSPM,Hybrid - Bay Area,0.85,,https://startup310.wd1.myworkdayjobs.com/en-US/careers,,"saas compliance, saas security posture, security posture management, saas security"
Startup397,,SaaS Security,"San Francisco, CA",0.9,,https://startup397.wd1.myworkdayjobs.com/en-US/careers,,"ai security, cloud application security, saas security, genai security, ai agent risk"
Startup245,,SaaS Security,"Boston, MA",0.85,,https://startup245.wd1.myworkdayjobs.com/en-US/careers,,"llm security, saas security posture, ai agent security"
Startup11,,SaaS Security,"San Francisco, CA",0.9,,https://startup11.wd1.myworkdayjobs.com/en-US/careers,,"ai security, generative ai compliance, saas risk, saas posture management, ai agent security"
Startup16,,AI Compliance,Hybrid - Bay Area,0.7,,https://startup16.wd1.myworkdayjobs.com/en-US/careers,,"generative ai compliance, ai governance, ai security, sanctioned it"
Startup44,,SSPM,"San Francisco, CA",0.85,,https://startup44.wd1.myworkdayjobs.com/en-US/careers,,"saas posture management, ai agent security, genai security, cloud compliance"
Startup156,,SaaS Security,Remote,0.9,,https://startup156.wd1.myworkdayjobs.com/en-US/careers,,"shadow it, saas security, cloud application security, sspm, generative ai compliance"
Startup283,,SaaS Security,Remote (US),0.85,,https://startup283.wd1.myworkdayjobs.com/en-US/careers,,"ai compliance, autonomous agent security, sanctioned it, generative ai compliance, saas security posture"
Startup274,,SSPM,"San Francisco, CA",0.85,,https://startup274.wd1.myworkdayjobs.com/en-US/careers,,"ai compliance, saas security posture, saas posture management, generative ai compliance"
Target,,SSPM,Remote,0.85,,https://target.wd1.myworkdayjobs.com/en-US/careers,,"sspm, ai governance, generative ai compliance, saas risk, saas security"
PayPal,,SSPM,"London, UK",0.85,,https://paypal.wd1.myworkdayjobs.com/en-US/careers,,"ai governance, autonomous agent security, saas risk, cloud compliance"
Netflix,,SSPM,"Austin, TX",0.85,,https://netflix.wd1.myworkdayjobs.com/en-US/careers,,"security posture management, saas governance, saas risk, saas posture management"
Startup160,,SSPM,"London, UK",0.9,,https://startup160.wd1.myworkdayjobs.com/en-US/careers,,"ai policy, saas posture management, generative ai compliance, autonomous agent security, sspm"
Startup53,,SaaS Security,"Austin, TX",0.9,,https://startup53.wd1.myworkdayjobs.com/en-US/careers,,"saas security, cloud compliance, ai governance, shadow it, llm compliance"
Startup298,,SaaS Security,"New York, NY",0.9,,https://startup298.wd1.myworkdayjobs.com/en-US/careers,,"autonomous agent security, genai security, llm compliance, saas audit, ai agent security"
Startup218,,SaaS Security,"Toronto, Canada",0.9,,https://startup218.wd1.myworkdayjobs.com/en-US/careers,,"sspm, llm compliance, saas security, saas risk"
Startup21,,SSPM,"Toronto, Canada",0.9,,https://startup21.wd1.myworkdayjobs.com/en-US/careers,,"saas posture management, cloud application security, saas risk, llm compliance, saas security posture"
Startup170,,SaaS Security,"Boston, MA",0.85,,https://startup170.wd1.myworkdayjobs.com/en-US/careers,,"cloud app security, ai policy, llm security, shadow it, ai security"
Palo Alto Networks,,SSPM,Remote,0.9,,https://palo-alto-networks.wd1.myworkdayjobs.com/en-US/careers,,"ai policy, saas audit, sspm, shadow it, saas compliance"
Startup129,,SaaS Security,Remote (US),0.85,,https://startup129.wd1.myworkdayjobs.com/en-US/careers,,"ai agent security, saas audit, ai policy, llm compliance"
Startup315,,SaaS Security,"Seattle, WA",0.85,,https://startup315.wd1.myworkdayjobs.com/en-US/careers,,"cloud application security, saas compliance, ai security, cloud app security, saas risk"
Startup12,,SSPM,"San Francisco, CA",0.85,,https://startup12.wd1.myworkdayjobs.com/en-US/careers,,"sspm, saas compliance, ai agent risk, autonomous agent security"
Startup177,,SaaS Security,"Toronto, Canada",0.85,,https://startup177.wd1.myworkdayjobs.com/en-US/careers,,"saas security, ai governance"
IBM,,AI Compliance,"London, UK",0.85,,https://ibm.wd1.myworkdayjobs.com/en-US/careers,,"generative ai compliance, saas security, genai security"
Startup44,,SSPM,"London, UK",0.85,,https://startup44.wd1.myworkdayjobs.com/en-US/careers,,"llm compliance, saas audit, ai policy, ai governance, security posture management"
Startup215,,AI Agent Security,"Boston, MA",0.7,,https://startup215.wd1.myworkdayjobs.com/en-US/careers,,"sanctioned it, llm compliance, ai agent security"
Startup66,,SaaS Security,"Denver, CO",0.85,,https://startup66.wd1.myworkdayjobs.com/en-US/careers,,"saas security posture, cloud app security, genai security, autonomous agent security"
Startup269,,SaaS Security,"London, UK",0.85,,https://startup269.wd1.myworkdayjobs.com/en-US/careers,,"saas audit, cloud governance, saas security, saas risk"
Startup83,,SSPM,"Denver, CO",0.85,,https://startup83.wd1.myworkdayjobs.com/en-US/careers,,"ai agent security, cloud compliance, shadow it, saas security posture"
Startup301,,SaaS Security,"London, UK",0.8,,https://startup301.wd1.myworkdayjobs.com/en-US/careers,,"cloud app security, autonomous agent security"
Startup39,,SSPM,"Toronto, Canada",0.85,,https://startup39.wd1.myworkdayjobs.com/en-US/careers,,"saas governance, security posture management, shadow it, sanctioned it, cloud governance"
Proofpoint,,SaaS Compliance,Remote (US),0.85,,https://proofpoint.wd1.myworkdayjobs.com/en-US/careers,,"saas compliance, saas security"
Startup209,,SaaS Security,Remote (US),0.85,,https://startup209.wd1.myworkdayjobs.com/en-US/careers,,"saas audit, saas security, ai policy, ai security"
Startup327,,SSPM,"Denver, CO",0.85,,https://startup327.wd1.myworkdayjobs.com/en-US/careers,,"cloud app security, ai policy, cloud application security, ai governance, saas posture management"
Startup132,,SaaS Security,"Denver, CO",0.7,,https://startup132.wd1.myworkdayjobs.com/en-US/careers,,"ai agent risk, cloud governance"
Startup201,,AI Compliance,"London, UK",0.7,,https://startup201.wd1.myworkdayjobs.com/en-US/careers,,"llm compliance, generative ai compliance"
Startup109,,SaaS Security,"New York, NY",0.9,,https://startup109.wd1.myworkdayjobs.com/en-US/careers,,"sanctioned it, saas security, sspm, autonomous agent security, cloud app security"
